{
  "$schema": "../../schemas/code.schema.json",
  "id": "new-code",
  "kind": "code",
  "name": "New code",
  "summary": "One sentence: what it is and why it matters.",
  "trust": "unconfirmed",
  "sources": [
    "tay"
  ],
  "last_updated": "2026-10-27",
  "code": "EXAMPLECODE",
  "reward": "2× XP for 1 h",
  "status": "active",
  "checked": "2026-10-27"
}
