{
  "id": "thx10klikes26",
  "kind": "code",
  "name": "THX10KLIKES26",
  "summary": "Widely reported as working.",
  "trust": "unconfirmed",
  "sources": [
    "wiki-codes"
  ],
  "last_updated": "2026-10-27",
  "code": "THX10KLIKES26",
  "status": "active",
  "checked": "2026-10-25",
  "reward": "4× XP for 30 min"
}
