{
  "id": "thx17klikes",
  "kind": "code",
  "name": "THX17KLIKES",
  "summary": "Widely reported as working.",
  "trust": "unconfirmed",
  "sources": [
    "wiki-codes"
  ],
  "last_updated": "2026-10-27",
  "code": "THX17KLIKES",
  "status": "active",
  "checked": "2026-10-25",
  "reward": "3× XP for 1 h, 150k Cash and 200 Werewolf Skin Fragments"
}
