{
  "id": "thx14klikes",
  "kind": "code",
  "name": "THX14KLIKES",
  "summary": "Reported by only a few sources.",
  "trust": "unconfirmed",
  "sources": [
    "wiki-codes"
  ],
  "last_updated": "2026-10-27",
  "code": "THX14KLIKES",
  "status": "thin",
  "checked": "2026-10-25",
  "notes": "Missing from the 24 October Destructoid list.",
  "reward": "4× XP for 30 min"
}
