{
  "id": "thankyou300",
  "kind": "code",
  "name": "ThankYou300",
  "summary": "Sources disagree on whether this still works.",
  "trust": "unconfirmed",
  "sources": [
    "wiki-codes"
  ],
  "last_updated": "2026-10-27",
  "code": "ThankYou300",
  "status": "disputed",
  "checked": "2026-10-25",
  "tbc": [
    "reward"
  ]
}
