{
  "id": "11klikesthx",
  "kind": "code",
  "name": "11KLIKESTHX",
  "summary": "Widely reported as working.",
  "trust": "unconfirmed",
  "sources": [
    "wiki-codes"
  ],
  "last_updated": "2026-10-27",
  "code": "11KLIKESTHX",
  "status": "active",
  "checked": "2026-10-25",
  "reward": "4× XP for 2 h"
}
