{
  "id": "thx9klikes",
  "kind": "code",
  "name": "THX9KLIKES",
  "summary": "Widely reported as working.",
  "trust": "unconfirmed",
  "sources": [
    "wiki-codes"
  ],
  "last_updated": "2026-10-27",
  "code": "THX9KLIKES",
  "status": "active",
  "checked": "2026-10-25",
  "disputed": [
    "Some sources say 1 h."
  ],
  "reward": "3× XP for 3 h"
}
